[
  {
    "id": "sy-example-governorate",
    "name": {
      "en": "Example Governorate",
      "ar": "\u0645\u062d\u0627\u0641\u0638\u0629 \u0645\u062b\u0627\u0644"
    },
    "aliases": [
      {
        "value": "Example Gov",
        "language": "en",
        "type": "alias"
      }
    ],
    "iso31662": null,
    "centroid": {
      "latitude": 35,
      "longitude": 38
    },
    "area": {
      "value": 1000,
      "unit": "km2",
      "sourceIds": ["fixture-source"]
    },
    "population": {
      "value": 100000,
      "year": 2020,
      "sourceIds": ["fixture-source"]
    },
    "externalIds": {},
    "sourceIds": ["fixture-source"],
    "sourceStatus": "seed",
    "notes": "Fixture record only. Do not copy into canonical data."
  }
]
